{
  "schemaVersion": "1.1",
  "title": "Price offer (negotiation)",
  "lang": "en",
  "initiative": {
    "productId": "flea-market",
    "id": "offer",
    "path": "1-2",
    "status": "proposed",
    "parent": {
      "scopeId": "root",
      "canonicalization": "sot-c14n-v1",
      "digest": "sha256:028cdca9baef4686ef36bd957c0f612a780871358ea0b81bb0762fda4059315f"
    }
  },
  "flow": {
    "start": "P1",
    "transitions": [
      {
        "from": "P1",
        "to": "P2",
        "ref": "F1"
      },
      {
        "from": "P2",
        "to": "P3",
        "ref": "F2"
      },
      {
        "from": "P3",
        "to": "P1",
        "label": "negotiation done"
      }
    ]
  },
  "ia": {
    "sections": [
      {
        "title": "Listing",
        "id": "S1",
        "boundary": {
          "scopeId": "root",
          "sectionId": "S3"
        },
        "pages": [
          {
            "title": "Listing detail",
            "id": "P1",
            "type": "page",
            "refs": [],
            "boundary": {
              "pageId": "P7",
              "scopeId": "root"
            },
            "children": [
              {
                "title": "Price offer",
                "id": "P2",
                "type": "page",
                "refs": [
                  "F1",
                  "F1:0",
                  "F1:1"
                ],
                "children": []
              },
              {
                "title": "Manage offers",
                "id": "P3",
                "type": "page",
                "refs": [
                  "F2",
                  "F2:0"
                ],
                "children": []
              }
            ]
          }
        ]
      }
    ]
  },
  "prd": {
    "goal": "Raise the chat-conversion rate of listings that receive an offer by 15% versus before",
    "inScope": [
      "Send a price offer from the listing detail",
      "Seller accept, decline, or counter",
      "Offer-status notifications"
    ],
    "nonGoals": [
      "Automated price negotiation (bots)",
      "Auction or bidding"
    ],
    "problem": "A buyer put off by the asking price often just leaves without a word. Haggling is common in local deals, but the app has no place to negotiate, so buyers must awkwardly open with 'can you lower it?' in chat",
    "scenarios": [
      {
        "start": "P2",
        "text": "Jiyoung offers $80 on a $100 sofa; the seller counters at $90, and she accepts to start the deal"
      }
    ],
    "solution": "Offer a price right from the listing detail, and the seller responds with accept, decline, or counter. Structuring the haggle lowers the barrier to starting a deal"
  },
  "requirements": [
    {
      "title": "Price offer",
      "id": "R1",
      "status": "todo",
      "priority": "mid",
      "desc": "A haggle flow where the buyer offers and the seller responds",
      "acceptance": [
        {
          "done": false,
          "text": "No deal is confirmed before the seller responds"
        }
      ],
      "features": [
        {
          "title": "Send an offer",
          "id": "F1",
          "status": "todo",
          "priority": "mid",
          "desc": "The buyer proposes a desired price",
          "acceptance": [
            {
              "done": false,
              "text": "A buyer can send one active offer with an amount at or below the asking price and an optional message."
            }
          ],
          "specs": [
            {
              "title": "Amount input",
              "desc": "Enter a desired amount at or below the asking price",
              "acceptance": []
            },
            {
              "title": "Attach a message",
              "desc": "Add a short message to the offer",
              "acceptance": []
            }
          ]
        },
        {
          "title": "Seller response",
          "id": "F2",
          "status": "todo",
          "priority": "mid",
          "desc": "Reply with accept, decline, or counter",
          "acceptance": [
            {
              "done": false,
              "text": "The seller can accept, decline, or counter an active offer, and the buyer sees the resulting status."
            }
          ],
          "specs": [
            {
              "title": "Accept, decline, or counter",
              "desc": "Respond to an offer in three ways",
              "acceptance": []
            }
          ]
        }
      ]
    }
  ]
}
