{
  "schemaVersion": "1.1",
  "title": "Payment",
  "lang": "en",
  "initiative": {
    "productId": "shop",
    "id": "payment",
    "path": "1-2",
    "status": "approved",
    "parent": {
      "scopeId": "root",
      "canonicalization": "sot-c14n-v1",
      "digest": "sha256:0d71aa889e1a726efe4f581fb7fa743c20a92c4b83edb4dd8105a7be4d2dd935"
    }
  },
  "flow": {
    "start": "P1",
    "transitions": [
      {
        "from": "P1",
        "to": "P2",
        "ref": "F1"
      }
    ]
  },
  "ia": {
    "sections": [
      {
        "title": "Checkout",
        "id": "S1",
        "pages": [
          {
            "title": "Cart",
            "id": "P1",
            "type": "page",
            "refs": [],
            "boundary": {
              "pageId": "P2",
              "scopeId": "root"
            },
            "children": [
              {
                "title": "Pay",
                "id": "P2",
                "type": "page",
                "refs": [
                  "F1"
                ],
                "children": []
              }
            ]
          }
        ]
      }
    ]
  },
  "prd": {
    "alternatives": "",
    "assumptions": [],
    "category": "",
    "constraints": [],
    "differentiator": "",
    "goal": "Let members pay",
    "inScope": [],
    "kpis": [],
    "nonGoals": [],
    "northStar": "",
    "oneLiner": "Checkout",
    "openQuestions": [],
    "platforms": [],
    "problem": "No checkout",
    "risks": [],
    "scenarios": [],
    "solution": "Add a pay step from the cart",
    "targets": [],
    "whyNow": ""
  },
  "requirements": [
    {
      "title": "Pay",
      "id": "R1",
      "status": "todo",
      "priority": "mid",
      "desc": "",
      "acceptance": [],
      "features": [
        {
          "title": "Checkout",
          "id": "F1",
          "status": "todo",
          "priority": "mid",
          "desc": "",
          "acceptance": [],
          "specs": []
        }
      ]
    }
  ]
}
