{
  "schemaVersion": "1.1",
  "title": "Safe payment (escrow)",
  "lang": "en",
  "initiative": {
    "productId": "flea-market",
    "id": "escrow",
    "path": "1-1",
    "status": "approved",
    "parent": {
      "scopeId": "root",
      "canonicalization": "sot-c14n-v1",
      "digest": "sha256:028cdca9baef4686ef36bd957c0f612a780871358ea0b81bb0762fda4059315f"
    }
  },
  "flow": {
    "start": "P1",
    "transitions": [
      {
        "from": "P1",
        "to": "P2",
        "ref": "F2"
      },
      {
        "from": "P2",
        "to": "P3",
        "ref": "F1"
      },
      {
        "from": "P3",
        "to": "P4",
        "ref": "F1:1"
      },
      {
        "from": "P4",
        "to": "P5",
        "ref": "F1:2"
      },
      {
        "from": "P5",
        "to": "P1",
        "label": "deal complete"
      }
    ]
  },
  "ia": {
    "sections": [
      {
        "title": "Chat & deal",
        "id": "S1",
        "boundary": {
          "scopeId": "root",
          "sectionId": "S4"
        },
        "pages": [
          {
            "title": "Deal-status management",
            "id": "P1",
            "type": "page",
            "refs": [],
            "boundary": {
              "pageId": "P12",
              "scopeId": "root"
            },
            "children": [
              {
                "title": "Safe-payment guidance",
                "id": "P2",
                "type": "page",
                "refs": [
                  "F2"
                ],
                "children": []
              },
              {
                "title": "Payment",
                "id": "P3",
                "type": "page",
                "refs": [
                  "F1",
                  "F1:0"
                ],
                "children": [
                  {
                    "title": "Confirm receipt",
                    "id": "P4",
                    "type": "action",
                    "refs": [
                      "F1:1"
                    ],
                    "children": []
                  }
                ]
              },
              {
                "title": "Settlement",
                "id": "P5",
                "type": "page",
                "refs": [
                  "F1:2"
                ],
                "children": []
              }
            ]
          }
        ]
      }
    ]
  },
  "prd": {
    "goal": "Raise the completion rate of high-value deals (over $80) by 20% versus before safe payment",
    "inScope": [
      "Escrow hold of the payment",
      "Settlement to the seller after the buyer confirms receipt",
      "Safe-payment guidance entered from chat and deal status"
    ],
    "nonGoals": [
      "Shipping integration (still meet in person)",
      "Automated arbitration of refunds and disputes (deferred to manual support)"
    ],
    "problem": "In-person deals settle in cash or bank transfer, so the buyer must send money before receiving the item — a moment of fraud exposure. The pricier the item, the more 'pay first' anxiety kills the deal",
    "scenarios": [
      {
        "start": "P2",
        "text": "Jiyoung buys a $200 bike with safe payment, holds the amount in escrow, inspects it in person, then taps confirm receipt so it settles to the seller"
      }
    ],
    "solution": "The app holds the payment in escrow and settles it to the seller once the buyer confirms receipt. It adds a safeguard where goods and money move together to in-person dealing"
  },
  "requirements": [
    {
      "title": "Safe payment",
      "id": "R1",
      "status": "todo",
      "priority": "high",
      "desc": "Hold the payment in escrow and settle after receipt confirmation",
      "acceptance": [
        {
          "done": false,
          "text": "Nothing settles to the seller before receipt is confirmed"
        }
      ],
      "features": [
        {
          "title": "Escrow payment",
          "id": "F1",
          "status": "todo",
          "priority": "high",
          "desc": "Deal safely in three steps: hold, confirm receipt, settle",
          "acceptance": [
            {
              "done": false,
              "text": "The held amount cannot be settled until the buyer confirms receipt, and both parties can see the current escrow state."
            }
          ],
          "specs": [
            {
              "title": "Hold payment",
              "desc": "When the buyer pays, the app holds the amount",
              "acceptance": [
                {
                  "done": false,
                  "text": "On hold, the seller is notified of the escrow"
                }
              ]
            },
            {
              "title": "Confirm receipt",
              "desc": "The buyer confirms receipt of the item",
              "acceptance": []
            },
            {
              "title": "Settle",
              "desc": "On receipt confirmation, settle the held amount to the seller",
              "acceptance": []
            }
          ]
        },
        {
          "title": "Safe-payment guidance",
          "id": "F2",
          "status": "todo",
          "priority": "mid",
          "desc": "Guide the use of safe payment from the deal-status screen",
          "acceptance": [
            {
              "done": false,
              "text": "The deal-status screen explains the hold, receipt confirmation, and settlement steps before the buyer starts payment."
            }
          ],
          "specs": []
        }
      ]
    }
  ]
}
